{
  "schemaId": "MandateBoundAp2EvidencePack/v1",
  "releaseVersion": "1.2.0",
  "profile": {
    "id": "ap2-v0.2.0+b4587ac1d055888a73b4b21750973cffba961793",
    "ap2Version": "0.2.0",
    "ap2ReleaseCommit": "b4587ac1d055888a73b4b21750973cffba961793",
    "mandateProfileId": "ap2-v0.2.0-mandate-chain+b4587ac1d055888a73b4b21750973cffba961793",
    "receiptReferenceProfile": "sha256-terminal-compact-jws",
    "retrievalTransport": "caller-supplied",
    "builtInNetworkAccess": false
  },
  "transactionId": "BsCAsEWUcSSvL8wGad3N3Zz4Nv87SJWFjnDy1ANgUG4",
  "asOf": "2026-07-23T00:00:00.000Z",
  "createdAt": "2026-07-23T00:00:00.000Z",
  "verificationPlan": {
    "checkoutMandate": {
      "issuerKeySnapshot": {
        "kid": "trusted-surface-key",
        "jwk": {
          "kty": "EC",
          "x": "SbqaFmIxE090U2UWWTEBnMxfuazqt_qJr9uI9agc6EY",
          "y": "7fVxDGfJ5mKSoNBblYIZJC834W4JA2IbDgYT5lap4_I",
          "crv": "P-256",
          "kid": "trusted-surface-key",
          "alg": "ES256",
          "use": "sig",
          "key_ops": [
            "verify"
          ]
        },
        "sourceDigest": "sha256:99e1453a9e31678b1f154ec2570fb817f4346cc254f3676e0fda67265067c90f",
        "capturedAt": "2026-04-29T00:00:00.000Z",
        "validUntil": "2027-04-29T00:00:00.000Z"
      },
      "expectedIssuerKeySourceDigest": "sha256:99e1453a9e31678b1f154ec2570fb817f4346cc254f3676e0fda67265067c90f",
      "expectedIssuer": "https://trusted-surface.example",
      "expectedAudience": "https://merchant.example",
      "expectedNonce": "checkout-nonce",
      "allowedAlgorithms": [
        "ES256"
      ],
      "requireKeyBinding": true,
      "expectedAgentJwk": {
        "kty": "EC",
        "x": "YEKQaDjdo57ypKyVO25p3lhIlW-EGLwXUrMvyihRii0",
        "y": "kqRFrVyOsPs_HkwWOK6VfIh82p0YnHEBAMmtgdAmUZo",
        "crv": "P-256",
        "kid": "shopping-agent-key",
        "alg": "ES256",
        "use": "sig",
        "key_ops": [
          "verify"
        ]
      },
      "expectedCheckoutJwt": "eyJhbGciOiJFUzI1NiIsImtpZCI6ImNoZWNrb3V0LWtleSIsInR5cCI6IkpXVCJ9.eyJpZCI6ImNoZWNrb3V0LXN5bnRoZXRpYy0xIiwibWVyY2hhbnQiOnsiaWQiOiJtZXJjaGFudC0xIiwibmFtZSI6IlN5bnRoZXRpYyBTdG9yZSIsIndlYnNpdGUiOiJodHRwczovL21lcmNoYW50LmV4YW1wbGUifSwibGluZV9pdGVtcyI6W3siaWQiOiJsaW5lLWl0ZW0tMSIsIml0ZW0iOnsiaWQiOiJza3UtMSIsInRpdGxlIjoiU3ludGhldGljIGl0ZW0ifSwicXVhbnRpdHkiOjEsInRvdGFscyI6W3sidHlwZSI6InN1YnRvdGFsIiwiYW1vdW50IjoyNTAwfSx7InR5cGUiOiJ0b3RhbCIsImFtb3VudCI6MjUwMH1dfV0sInN0YXR1cyI6ImluY29tcGxldGUiLCJjdXJyZW5jeSI6IlVTRCIsInRvdGFscyI6W3sidHlwZSI6InN1YnRvdGFsIiwiYW1vdW50IjoyNTAwfSx7InR5cGUiOiJ0b3RhbCIsImFtb3VudCI6MjUwMH1dLCJsaW5rcyI6W119.YencmAWjWtj5ehMfhTrkI4IAigGku82VCOKxdWPPiGqIdDKFGOo1lG1FVAdmekPecZ1jtj2f6xCkZbzqqozrmg"
    },
    "checkoutJwt": {
      "merchantKeySnapshot": {
        "kid": "checkout-key",
        "jwk": {
          "kty": "EC",
          "x": "Bot2ZAD3IcCDMDS9k7DuGr_xCUC5FjDqi7xcbKiKjB0",
          "y": "8bQEh3GUAll_nOg2yfp8eGFP1PcNpwqPSy7QCfeyFT8",
          "crv": "P-256",
          "kid": "checkout-key",
          "alg": "ES256",
          "use": "sig",
          "key_ops": [
            "verify"
          ]
        },
        "sourceDigest": "sha256:99e1453a9e31678b1f154ec2570fb817f4346cc254f3676e0fda67265067c90f",
        "capturedAt": "2026-04-29T00:00:00.000Z",
        "validUntil": "2027-04-29T00:00:00.000Z"
      },
      "expectedMerchantKeySourceDigest": "sha256:99e1453a9e31678b1f154ec2570fb817f4346cc254f3676e0fda67265067c90f",
      "allowedAlgorithms": [
        "ES256"
      ]
    },
    "paymentMandate": {
      "issuerKeySnapshot": {
        "kid": "trusted-surface-key",
        "jwk": {
          "kty": "EC",
          "x": "SbqaFmIxE090U2UWWTEBnMxfuazqt_qJr9uI9agc6EY",
          "y": "7fVxDGfJ5mKSoNBblYIZJC834W4JA2IbDgYT5lap4_I",
          "crv": "P-256",
          "kid": "trusted-surface-key",
          "alg": "ES256",
          "use": "sig",
          "key_ops": [
            "verify"
          ]
        },
        "sourceDigest": "sha256:99e1453a9e31678b1f154ec2570fb817f4346cc254f3676e0fda67265067c90f",
        "capturedAt": "2026-04-29T00:00:00.000Z",
        "validUntil": "2027-04-29T00:00:00.000Z"
      },
      "expectedIssuerKeySourceDigest": "sha256:99e1453a9e31678b1f154ec2570fb817f4346cc254f3676e0fda67265067c90f",
      "expectedIssuer": "https://trusted-surface.example",
      "expectedAudience": "https://processor.example",
      "expectedNonce": "payment-nonce",
      "allowedAlgorithms": [
        "ES256"
      ],
      "requireKeyBinding": true,
      "expectedAgentJwk": {
        "kty": "EC",
        "x": "YEKQaDjdo57ypKyVO25p3lhIlW-EGLwXUrMvyihRii0",
        "y": "kqRFrVyOsPs_HkwWOK6VfIh82p0YnHEBAMmtgdAmUZo",
        "crv": "P-256",
        "kid": "shopping-agent-key",
        "alg": "ES256",
        "use": "sig",
        "key_ops": [
          "verify"
        ]
      }
    },
    "checkoutReceipt": {
      "issuerKeySnapshot": {
        "kid": "merchant-receipt-key",
        "jwk": {
          "kty": "EC",
          "x": "JwD2UJeapBrCg0VlOiMXYObkoxZXGxK_yo8vBr56rn0",
          "y": "l_nWAB5YtsF5v-YMuae4ZKLOida-fG_CHthrHD6F4kY",
          "crv": "P-256",
          "kid": "merchant-receipt-key",
          "alg": "ES256",
          "use": "sig",
          "key_ops": [
            "verify"
          ]
        },
        "sourceDigest": "sha256:99e1453a9e31678b1f154ec2570fb817f4346cc254f3676e0fda67265067c90f",
        "capturedAt": "2026-04-29T00:00:00.000Z",
        "validUntil": "2027-04-29T00:00:00.000Z"
      },
      "expectedIssuerKeySourceDigest": "sha256:99e1453a9e31678b1f154ec2570fb817f4346cc254f3676e0fda67265067c90f",
      "expectedIssuer": "https://merchant.example",
      "allowedAlgorithms": [
        "ES256"
      ]
    },
    "paymentReceipt": {
      "issuerKeySnapshot": {
        "kid": "processor-receipt-key",
        "jwk": {
          "kty": "EC",
          "x": "3kKoDvDywZPZ7CReTYoe0fPQGjpgzSKAH_QEyOkYEnk",
          "y": "EWD_Jg66MRgFRzc_76NTXQGaq2vafJN4PKd2US53se4",
          "crv": "P-256",
          "kid": "processor-receipt-key",
          "alg": "ES256",
          "use": "sig",
          "key_ops": [
            "verify"
          ]
        },
        "sourceDigest": "sha256:99e1453a9e31678b1f154ec2570fb817f4346cc254f3676e0fda67265067c90f",
        "capturedAt": "2026-04-29T00:00:00.000Z",
        "validUntil": "2027-04-29T00:00:00.000Z"
      },
      "expectedIssuerKeySourceDigest": "sha256:99e1453a9e31678b1f154ec2570fb817f4346cc254f3676e0fda67265067c90f",
      "expectedIssuer": "https://processor.example",
      "allowedAlgorithms": [
        "ES256"
      ]
    }
  },
  "sources": [
    {
      "sourceId": "merchant-primary",
      "role": "merchant",
      "retrievedAt": "2026-07-22T23:59:00.000Z",
      "artifacts": [
        {
          "kind": "checkout_mandate",
          "token": "eyJhbGciOiJFUzI1NiIsImtpZCI6InRydXN0ZWQtc3VyZmFjZS1rZXkiLCJ0eXAiOiJkYytzZC1qd3QifQ.eyJfc2RfYWxnIjoic2hhLTI1NiIsImRlbGVnYXRlX3BheWxvYWQiOlt7InZjdCI6Im1hbmRhdGUuY2hlY2tvdXQub3Blbi4xIiwiaWF0IjoxNzcwMDAwMDAwLCJleHAiOjE4MDAwMDAwMDAsImNvbnN0cmFpbnRzIjpbeyJ0eXBlIjoiY2hlY2tvdXQuYWxsb3dlZF9tZXJjaGFudHMiLCJhbGxvd2VkIjpbeyIuLi4iOiJ3R3lQS3BjU19TNEFUNUlocVlYQ0RHamdJS0s0R05zX1ItdGEtLUdCcGhBIn0seyIuLi4iOiJuckxrZDhhTUlfZHZ3Ukw4a1MzYkJXYXU3Ry1PMHFqVnR5VGVUSHBVUmtvIn1dfSx7InR5cGUiOiJjaGVja291dC5saW5lX2l0ZW1zIiwiaXRlbXMiOlt7ImlkIjoicmVxdWlyZW1lbnQtMSIsImFjY2VwdGFibGVfaXRlbXMiOlt7Ii4uLiI6IlRUa3VsZTBTWHo5SjhENWk1SkdNX1Q0MmlFRDBfYnNJa3FITjQyeGFYZFEifSx7Ii4uLiI6IjJrLUpzR1p0c3NUOXcxb2M5MjloazBIWjhjSkVRU05DdjQyQVVnUkcwQk0ifV0sInF1YW50aXR5IjoxfV19XSwiY25mIjp7Imp3ayI6eyJrdHkiOiJFQyIsIngiOiJZRUtRYURqZG81N3lwS3lWTzI1cDNsaElsVy1FR0x3WFVyTXZ5aWhSaWkwIiwieSI6ImtxUkZyVnlPc1BzX0hrd1dPSzZWZkloODJwMFluSEVCQU1tdGdkQW1VWm8iLCJjcnYiOiJQLTI1NiIsImtpZCI6InNob3BwaW5nLWFnZW50LWtleSIsImFsZyI6IkVTMjU2IiwidXNlIjoic2lnIiwia2V5X29wcyI6WyJ2ZXJpZnkiXX19fV19.9E1GjcHZu1YFJ_YkdrMqGlk1l1dAH3671wMmtohDcLt05CxpV2lPoNA_GmBqZBfe6Xo1Hd7y8lxb_VvI0nd_xw~WyJzeW50aGV0aWMtc2FsdC0xIix7ImlkIjoibWVyY2hhbnQtMSIsIm5hbWUiOiJTeW50aGV0aWMgU3RvcmUiLCJ3ZWJzaXRlIjoiaHR0cHM6Ly9tZXJjaGFudC5leGFtcGxlIn1d~WyJzeW50aGV0aWMtc2FsdC0zIix7ImlkIjoic2t1LTEiLCJ0aXRsZSI6IlN5bnRoZXRpYyBpdGVtIn1d~~eyJhbGciOiJFUzI1NiIsImtpZCI6InNob3BwaW5nLWFnZW50LWtleSIsInR5cCI6ImtiK3NkLWp3dCJ9.eyJfc2RfYWxnIjoic2hhLTI1NiIsImF1ZCI6Imh0dHBzOi8vbWVyY2hhbnQuZXhhbXBsZSIsIm5vbmNlIjoiY2hlY2tvdXQtbm9uY2UiLCJpYXQiOjE3NzAwMDAwMDAsInNkX2hhc2giOiJOSUxFbkpMTlZsd1M5cFd1a1JwbnN4N2dsMWlycjl0bHhJdWlfVjVsdDZrIiwiZGVsZWdhdGVfcGF5bG9hZCI6W3siaXNzIjoiaHR0cHM6Ly90cnVzdGVkLXN1cmZhY2UuZXhhbXBsZSIsInZjdCI6Im1hbmRhdGUuY2hlY2tvdXQuMSIsImlhdCI6MTc3MDAwMDAwMCwiZXhwIjoxODAwMDAwMDAwLCJjaGVja291dF9qd3QiOiJleUpoYkdjaU9pSkZVekkxTmlJc0ltdHBaQ0k2SW1Ob1pXTnJiM1YwTFd0bGVTSXNJblI1Y0NJNklrcFhWQ0o5LmV5SnBaQ0k2SW1Ob1pXTnJiM1YwTFhONWJuUm9aWFJwWXkweElpd2liV1Z5WTJoaGJuUWlPbnNpYVdRaU9pSnRaWEpqYUdGdWRDMHhJaXdpYm1GdFpTSTZJbE41Ym5Sb1pYUnBZeUJUZEc5eVpTSXNJbmRsWW5OcGRHVWlPaUpvZEhSd2N6b3ZMMjFsY21Ob1lXNTBMbVY0WVcxd2JHVWlmU3dpYkdsdVpWOXBkR1Z0Y3lJNlczc2lhV1FpT2lKc2FXNWxMV2wwWlcwdE1TSXNJbWwwWlcwaU9uc2lhV1FpT2lKemEzVXRNU0lzSW5ScGRHeGxJam9pVTNsdWRHaGxkR2xqSUdsMFpXMGlmU3dpY1hWaGJuUnBkSGtpT2pFc0luUnZkR0ZzY3lJNlczc2lkSGx3WlNJNkluTjFZblJ2ZEdGc0lpd2lZVzF2ZFc1MElqb3lOVEF3ZlN4N0luUjVjR1VpT2lKMGIzUmhiQ0lzSW1GdGIzVnVkQ0k2TWpVd01IMWRmVjBzSW5OMFlYUjFjeUk2SW1sdVkyOXRjR3hsZEdVaUxDSmpkWEp5Wlc1amVTSTZJbFZUUkNJc0luUnZkR0ZzY3lJNlczc2lkSGx3WlNJNkluTjFZblJ2ZEdGc0lpd2lZVzF2ZFc1MElqb3lOVEF3ZlN4N0luUjVjR1VpT2lKMGIzUmhiQ0lzSW1GdGIzVnVkQ0k2TWpVd01IMWRMQ0pzYVc1cmN5STZXMTE5LlllbmNtQVdqV3RqNWVoTWZoVHJrSTRJQWlnR2t1ODJWQ09LeGRXUFBpR3FJZERLRkdPbzFsRzFGVkFkbWVrUGVjWjFqdGoyZjZ4Q2taYnpxcW96cm1nIiwiY2hlY2tvdXRfaGFzaCI6IkJzQ0FzRVdVY1NTdkw4d0dhZDNOM1p6NE52ODdTSldGam5EeTFBTmdVRzQifV19.95UBYSpj6Y8cva-EtrAggmjDkSYyAlFGpgvuzTHvtQJo_xwrXcmU0xM7ynbKlfLpH1ycx4sxLAQTjuxbkUZ3cw~"
        },
        {
          "kind": "checkout_receipt",